Source,Title,Link,Summary,SEO_Score,cleaned,topic_cluster,sentiment_score,lexicon_score,impact_score,impact_level
News.lk,Discussion held to establish a stable programme to resolve issues faced by local big onion farmers,https://news.lk/news/discussion-held-to-establish-a-stable-programme-to-resolve-issues-faced-by-local-big-onion-farmers,"A discussion aimed at formulating a systematic programme to address the issues faced by local big onion farmers was held this morning (17) at the Presidential Secretariat. It was held under the patronage of the Minister of Agriculture, Livestock, Land and Irrigation, K. D. Lal Kantha, together with the Minister of Trade, Commerce, Food Security and Cooperative Development, Wasantha Samarasinghe.
Minister K. D. Lal kantha pointed out that while a concrete programme has long existed to safeguard paddy farmers, no such systematic plan had been developed for other crops. He stated that this is the first time a government is preparing a definitive programme to resolve the problems of big onion farmers, emphasising that the present government’s objective is to protect all farmers and improve their living standards.
During the discussion, it was highlighted that while seeking solutions to issues in the big onion sector, priority must be given to farmer-related challenges, while also ensuring onions are made available to consumers at affordable prices. The Minister further emphasised that all decisions must be based on accurate data.
Matters relating to increasing big onion production and the pricing mechanism were discussed in detail. The Department of Agriculture also presented a report outlining strategies and actions for sustainable production and marketing related to local big onion cultivation.
A planned programme is currently underway to increase big onion production from 17% in 2025 to 22% in 2026 and 27% in 2027.
It was also stressed that the government has decided to introduce a stable price for big onions in a manner that is fair to farmers. Lengthy discussions were held on steps that could be taken to improve storage and other facilities for farmers.
Farmers pointed out that sharp price fluctuations caused by wide market gaps posed a major challenge, yet they continue with their cultivation amidst this risk. They requested the government to provide the necessary facilities to allow them to continue big onion cultivation as a sector that could generate significant income.
As many of the farmers engaged in this sector operate on small landholdings, Minister K. D. Lalkantha emphasised the need to consider such factors when calculating production costs and making policy decisions. He also urged all farmers to register under the Department of Agrarian Development so that necessary interventions can be made promptly in emergencies.
Farmers expressed their appreciation to the government for intervening with a definitive programme, where something is being done for the first time to address their challenges. They noted their confidence in the present government and said they were ready to work together with it in seeking solutions.
Deputy Minister of Agriculture and Livestock, Namal Karunaratne; Secretary to the Ministry of Agriculture, Livestock, Lands and Irrigation, D. P. Wickramasinghe; Senior Additional Secretary to the President, Kapila Janaka Bandara; Director General of Agriculture, Dr W. A. R. T. Wickramarachchi; senior officials of the Department of Agriculture; and a group of big onion farmers representing Dambulla and Galenbindunuwewa also took part in this discussion.",2,discussion held establish stable programme resolve issues faced local big onion farmers discussion aimed formulating systematic programme address issues faced local big onion farmers held morning 17 presidential secretariat held patronage minister agriculture livestock land irrigation k lal kantha together minister trade commerce food security cooperative development wasantha samarasinghe minister k lal kantha pointed concrete programme long existed safeguard paddy farmers systematic plan developed crops stated first time government preparing definitive programme resolve problems big onion farmers emphasising present government objective protect farmers improve living standards discussion highlighted seeking solutions issues big onion sector priority must given farmer related challenges also ensuring onions made available consumers affordable prices minister emphasised decisions must based accurate data matters relating increasing big onion production pricing mechanism discussed detail department agriculture also presented report outlining strategies actions sustainable production marketing related local big onion cultivation planned programme currently underway increase big onion production 17 2025 22 2026 27 2027 also stressed government decided introduce stable price big onions manner fair farmers lengthy discussions held steps could taken improve storage facilities farmers farmers pointed sharp price fluctuations caused wide market gaps posed major challenge yet continue cultivation amidst risk requested government provide necessary facilities allow continue big onion cultivation sector could generate significant income many farmers engaged sector operate small landholdings minister k lalkantha emphasised need consider factors calculating production costs making policy decisions also urged farmers register department agrarian development necessary interventions made promptly emergencies farmers expressed appreciation government intervening definitive programme something done first time address challenges noted confidence present government said ready work together seeking solutions deputy minister agriculture livestock namal karunaratne secretary ministry agriculture livestock lands irrigation p wickramasinghe senior additional secretary president kapila janaka bandara director general agriculture dr w r wickramarachchi senior officials department agriculture group big onion farmers representing dambulla galenbindunuwewa also took part discussion,3,0.9886,2.0,2.9886,High Opportunity
News.lk,Global Entrepreneurship Week 2025 Begins Under the Patronage of the Prime Minister,https://news.lk/news/global-entrepreneurship-week-2025-begins-under-the-patronage-of-the-prime-minister,All sectors must work in collective effort to empower local entrepreneurs for a digital economy.,2,global entrepreneurship week 2025 begins patronage prime minister sectors must work collective effort empower local entrepreneurs digital economy,3,0.0,2.0,2.0,Opportunity
News.lk,Cabinet Decisions,https://news.lk/news/cabinet-decisions,Cabinet Decisions taken at 10.11.2025,2,cabinet decisions cabinet decisions taken 10 11 2025,3,0.0,0.0,0.0,Neutral
Onlanka.com,HUTCH donates LKR 60 Million to support Sri Lankans affected by adverse weather,https://www.onlanka.com/news/hutch-donates-lkr-60-million-to-support-sri-lankans-affected-by-adverse-weather.html,"HUTCH, a leading telecommunications service provider in Sri Lanka, has donated LKR 60 million to assist people affected by the recent adverse weather in the country.
The post HUTCH donates LKR 60 Million to support Sri Lankans affected by adverse weather appeared first on Sri Lanka News | Breaking News &amp; Top Stories in Sri Lanka | ONLANKA.",1,hutch donates lkr 60 million support sri lankans affected adverse weather hutch leading telecommunications service provider sri lanka donated lkr 60 million assist people affected recent adverse weather country post hutch donates lkr 60 million support sri lankans affected adverse weather appeared first sri lanka news breaking news amp top stories sri lanka onlanka,1,-0.4767,0.0,-0.4767,Risk
Onlanka.com,Sri Lanka President honors Air Force Hero lost in relief mission,https://www.onlanka.com/news/sri-lanka-president-honors-air-force-hero-lost-in-relief-mission.html,"Sri Lanka President Anura Kumara Dissanayake paid his final respects to the remains of Group Captain Nirmal Siyambalapitiya, the pilot who died in the helicopter crash that occurred in the Lunuwila area in Wennappuwa while providing relief to disaster-affected communities.
The post Sri Lanka President honors Air Force Hero lost in relief mission appeared first on Sri Lanka News | Breaking News &amp; Top Stories in Sri Lanka | ONLANKA.",1,sri lanka president honors air force hero lost relief mission sri lanka president anura kumara dissanayake paid final respects remains group captain nirmal siyambalapitiya pilot died helicopter crash occurred lunuwila area wennappuwa providing relief disaster affected communities post sri lanka president honors air force hero lost relief mission appeared first sri lanka news breaking news amp top stories sri lanka onlanka,1,0.891,-3.0,-2.109,High Risk
Onlanka.com,Japan sends medical team to support Sri Lanka after Cyclone Ditwah,https://www.onlanka.com/news/japan-sends-medical-team-to-support-sri-lanka-after-cyclone-ditwah.html,"Japan has sent a Japan Disaster Relief (JDR) Medical Team to help Sri Lanka recover from the damage caused by Cyclone Ditwah.
The post Japan sends medical team to support Sri Lanka after Cyclone Ditwah appeared first on Sri Lanka News | Breaking News &amp; Top Stories in Sri Lanka | ONLANKA.",1,japan sends medical team support sri lanka cyclone ditwah japan sent japan disaster relief jdr medical team help sri lanka recover damage caused cyclone ditwah post japan sends medical team support sri lanka cyclone ditwah appeared first sri lanka news breaking news amp top stories sri lanka onlanka,1,0.5719,-10.0,-9.4281,High Risk
Onlanka.com,India sends more disaster relief to Sri Lanka after Cyclone Ditwah,https://www.onlanka.com/news/india-sends-more-disaster-relief-to-sri-lanka-after-cyclone-ditwah.html,"India delivered another shipment of disaster relief supplies to Sri Lanka yesterday (December 3) to support communities affected by Cyclone Ditwah.
The post India sends more disaster relief to Sri Lanka after Cyclone Ditwah appeared first on Sri Lanka News | Breaking News &amp; Top Stories in Sri Lanka | ONLANKA.",1,india sends disaster relief sri lanka cyclone ditwah india delivered another shipment disaster relief supplies sri lanka yesterday december 3 support communities affected cyclone ditwah post india sends disaster relief sri lanka cyclone ditwah appeared first sri lanka news breaking news amp top stories sri lanka onlanka,1,-0.2732,-10.0,-10.0,High Risk
Onlanka.com,Pakistan sends relief team and aid to Sri Lanka after Cyclone Ditwah,https://www.onlanka.com/news/pakistan-sends-relief-team-and-aid-to-sri-lanka-after-cyclone-ditwah.html,"A Pakistan Air Force C-130 aircraft carrying relief supplies and an elite search and rescue team arrived in Sri Lanka yesterday evening (December 3) at 6:45 PM.
The post Pakistan sends relief team and aid to Sri Lanka after Cyclone Ditwah appeared first on Sri Lanka News | Breaking News &amp; Top Stories in Sri Lanka | ONLANKA.",1,pakistan sends relief team aid sri lanka cyclone ditwah pakistan air force c 130 aircraft carrying relief supplies elite search rescue team arrived sri lanka yesterday evening december 3 6 45 pm post pakistan sends relief team aid sri lanka cyclone ditwah appeared first sri lanka news breaking news amp top stories sri lanka onlanka,1,0.9246,5.0,5.9246,High Opportunity
Onlanka.com,Thurstan College supports disaster fund with Rs. 3.25 Million,https://www.onlanka.com/news/thurstan-college-supports-disaster-fund-with-rs-3-25-million.html,"A financial contribution of Rs. 3,250,000.00 was officially handed over to Defence Secretary Air Vice Marshal Sampath Thuyacontha (Retd) at the Ministry of Defence yesterday (December 03), in support of the National Disaster Management Fund.
The post Thurstan College supports disaster fund with Rs. 3.25 Million appeared first on Sri Lanka News | Breaking News &amp; Top Stories in Sri Lanka | ONLANKA.",1,thurstan college supports disaster fund rs 3 25 million financial contribution rs 3 250 000 00 officially handed defence secretary air vice marshal sampath thuyacontha retd ministry defence yesterday december 03 support national disaster management fund post thurstan college supports disaster fund rs 3 25 million appeared first sri lanka news breaking news amp top stories sri lanka onlanka,1,-0.6124,-10.0,-10.0,High Risk
Onlanka.com,"ADB announces emergency grants for flood-hit Sri Lanka, Thailand, and Viet Nam",https://www.onlanka.com/news/adb-announces-emergency-grants-for-flood-hit-sri-lanka-thailand-and-viet-nam.html,"The Asian Development Bank (ADB) has announced immediate financial support for three countries in South and Southeast Asia following severe flooding that has caused major loss of life and widespread damage.
The post ADB announces emergency grants for flood-hit Sri Lanka, Thailand, and Viet Nam appeared first on Sri Lanka News | Breaking News &amp; Top Stories in Sri Lanka | ONLANKA.",1,adb announces emergency grants flood hit sri lanka thailand viet nam asian development bank adb announced immediate financial support three countries south southeast asia following severe flooding caused major loss life widespread damage post adb announces emergency grants flood hit sri lanka thailand viet nam appeared first sri lanka news breaking news amp top stories sri lanka onlanka,1,-0.7184,-10.0,-10.0,High Risk
Onlanka.com,U.S. announces $2 Million in emergency aid for Sri Lanka after Cyclone Ditwah,https://www.onlanka.com/news/u-s-announces-2-million-in-emergency-aid-for-sri-lanka-after-cyclone-ditwah.html,"The United States has announced $2 million in emergency, life-saving assistance for people affected by Tropical Cyclone Ditwah in Sri Lanka.
The post U.S. announces $2 Million in emergency aid for Sri Lanka after Cyclone Ditwah appeared first on Sri Lanka News | Breaking News &amp; Top Stories in Sri Lanka | ONLANKA.",1,u announces 2 million emergency aid sri lanka cyclone ditwah united states announced 2 million emergency life saving assistance people affected tropical cyclone ditwah sri lanka post u announces 2 million emergency aid sri lanka cyclone ditwah appeared first sri lanka news breaking news amp top stories sri lanka onlanka,1,-0.5859,-7.5,-8.0859,High Risk
Onlanka.com,UAE sends fourth humanitarian aid flight to cyclone-hit Sri Lanka,https://www.onlanka.com/news/uae-sends-fourth-humanitarian-aid-flight-to-cyclone-hit-sri-lanka.html,"The United Arab Emirates dispatched another humanitarian relief consignment to Sri Lanka today (December 3) as part of its ongoing support for communities affected by Cyclone Ditwah.
The post UAE sends fourth humanitarian aid flight to cyclone-hit Sri Lanka appeared first on Sri Lanka News | Breaking News &amp; Top Stories in Sri Lanka | ONLANKA.",1,uae sends fourth humanitarian aid flight cyclone hit sri lanka united arab emirates dispatched another humanitarian relief consignment sri lanka today december 3 part ongoing support communities affected cyclone ditwah post uae sends fourth humanitarian aid flight cyclone hit sri lanka appeared first sri lanka news breaking news amp top stories sri lanka onlanka,1,0.8316,-7.5,-6.6684,High Risk
Onlanka.com,Bangladesh delivers humanitarian aid to Sri Lanka,https://www.onlanka.com/news/bangladesh-delivers-humanitarian-aid-to-sri-lanka.html,"Bangladesh dispatched a humanitarian relief consignment to Sri Lanka this afternoon (December 03) to support ongoing recovery efforts following the devastation caused by recent adverse weather conditions in the country.
The post Bangladesh delivers humanitarian aid to Sri Lanka appeared first on Sri Lanka News | Breaking News &amp; Top Stories in Sri Lanka | ONLANKA.",1,bangladesh delivers humanitarian aid sri lanka bangladesh dispatched humanitarian relief consignment sri lanka afternoon december 03 support ongoing recovery efforts following devastation caused recent adverse weather conditions country post bangladesh delivers humanitarian aid sri lanka appeared first sri lanka news breaking news amp top stories sri lanka onlanka,1,0.3182,8.0,8.3182,High Opportunity
Onlanka.com,"Sri Lanka reports 479 dead, 350 missing after extreme weather",https://www.onlanka.com/news/sri-lanka-reports-479-dead-350-missing-after-extreme-weather.html,"The Disaster Management Centre (DMC) reports that 479 deaths caused by adverse weather conditions in Sri Lanka have been recorded so far, while 350 people remain missing.
The post Sri Lanka reports 479 dead, 350 missing after extreme weather appeared first on Sri Lanka News | Breaking News &amp; Top Stories in Sri Lanka | ONLANKA.",1,sri lanka reports 479 dead 350 missing extreme weather disaster management centre dmc reports 479 deaths caused adverse weather conditions sri lanka recorded far 350 people remain missing post sri lanka reports 479 dead 350 missing extreme weather appeared first sri lanka news breaking news amp top stories sri lanka onlanka,5,-0.9638,-10.0,-10.0,High Risk
Onlanka.com,Sri Lanka gains international support to recover corrupt assets abroad,https://www.onlanka.com/news/sri-lanka-gains-international-support-to-recover-corrupt-assets-abroad.html,"Senior officials from the StAR Initiative, a joint program of the World Bank and the United Nations Office on Drugs and Crime (UNODC), have offered technical and expert assistance to help Sri Lanka recover assets located abroad that are suspected to have been acquired through criminal activities.
The post Sri Lanka gains international support to recover corrupt assets abroad appeared first on Sri Lanka News | Breaking News &amp; Top Stories in Sri Lanka | ONLANKA.",1,sri lanka gains international support recover corrupt assets abroad senior officials star initiative joint program world bank united nations office drugs crime unodc offered technical expert assistance help sri lanka recover assets located abroad suspected acquired criminal activities post sri lanka gains international support recover corrupt assets abroad appeared first sri lanka news breaking news amp top stories sri lanka onlanka,1,0.8689,0.0,0.8689,Opportunity
Onlanka.com,"Sri Lanka President approves Rs. 25,000 aid for each affected student",https://www.onlanka.com/news/sri-lanka-president-approves-rs-25000-aid-for-each-affected-student.html,"Sri Lanka’s President Anura Kumara Dissanayake has decided to grant Rs. 25,000 to every school student affected by floods and landslides to support their educational activities.
The post Sri Lanka President approves Rs. 25,000 aid for each affected student appeared first on Sri Lanka News | Breaking News &amp; Top Stories in Sri Lanka | ONLANKA.",1,sri lanka president approves rs 25 000 aid affected student sri lanka president anura kumara dissanayake decided grant rs 25 000 every school student affected floods landslides support educational activities post sri lanka president approves rs 25 000 aid affected student appeared first sri lanka news breaking news amp top stories sri lanka onlanka,1,0.8225,6.0,6.8225,High Opportunity
Onlanka.com,India sends urgent medical aid and personnel to Sri Lanka,https://www.onlanka.com/news/india-sends-urgent-medical-aid-and-personnel-to-sri-lanka.html,"An Indian Air Force C-17A aircraft carrying urgent medical assistance arrived in Sri Lanka last evening (December 02).
The post India sends urgent medical aid and personnel to Sri Lanka appeared first on Sri Lanka News | Breaking News &amp; Top Stories in Sri Lanka | ONLANKA.",1,india sends urgent medical aid personnel sri lanka indian air force c 17a aircraft carrying urgent medical assistance arrived sri lanka last evening december 02 post india sends urgent medical aid personnel sri lanka appeared first sri lanka news breaking news amp top stories sri lanka onlanka,1,0.6369,6.0,6.6369,High Opportunity
Onlanka.com,Sri Lanka Parliament observes one minute of silence for disaster victims,https://www.onlanka.com/news/sri-lanka-parliament-observes-one-minute-of-silence-for-disaster-victims.html,"The Parliament of Sri Lanka observed a one-minute silence today (December 03) in remembrance of all those who lost their lives due to the recent disaster situation caused by adverse weather conditions.
The post Sri Lanka Parliament observes one minute of silence for disaster victims appeared first on Sri Lanka News | Breaking News &amp; Top Stories in Sri Lanka | ONLANKA.",1,sri lanka parliament observes one minute silence disaster victims parliament sri lanka observed one minute silence today december 03 remembrance lost lives due recent disaster situation caused adverse weather conditions post sri lanka parliament observes one minute silence disaster victims appeared first sri lanka news breaking news amp top stories sri lanka onlanka,1,-0.9633,-10.0,-10.0,High Risk
Onlanka.com,Apple steps in to help communities hit by severe storms in Asia,https://www.onlanka.com/news/apple-steps-in-to-help-communities-hit-by-severe-storms-in-asia.html,"Apple CEO Tim Cook has shared a message of support for people affected by recent storms across Thailand, Indonesia, Malaysia, and Sri Lanka.
The post Apple steps in to help communities hit by severe storms in Asia appeared first on Sri Lanka News | Breaking News &amp; Top Stories in Sri Lanka | ONLANKA.",1,apple steps help communities hit severe storms asia apple ceo tim cook shared message support people affected recent storms across thailand indonesia malaysia sri lanka post apple steps help communities hit severe storms asia appeared first sri lanka news breaking news amp top stories sri lanka onlanka,1,0.6705,0.0,0.6705,Opportunity
LankaBusinessOnline,Banks Association pledges strong support for economic revival,https://www.lankabusinessonline.com/banks-association-pledges-strong-support-for-economic-revival/,The Sri Lanka Banks Association (SLBA) in a meeting with the Governor of the Central Bank of Sri Lanka (CBSL) today pledged its fullest support to revive the country’s economy following the damage inflicted by Cyclone Ditwah.&#160; The banks represented by the Association stated that a detailed impact assessment has already been initiated across banks [&#8230;],3,banks association pledges strong support economic revival sri lanka banks association slba meeting governor central bank sri lanka cbsl today pledged fullest support revive country economy following damage inflicted cyclone ditwah 160 banks represented association stated detailed impact assessment already initiated across banks 8230,3,0.7845,-4.5,-3.7155,High Risk
LankaBusinessOnline,Sri Lanka economic summit opened with focus on recovery and resilience after cyclone Ditwah,https://www.lankabusinessonline.com/sri-lanka-economic-summit-opened-with-focus-on-recovery-and-resilience-after-cyclone-ditwah/,"The Ceylon Chamber of Commerce opened the Sri Lanka Economic &#38; Investment Summit on Tuesday with a renewed sense of purpose, reframing the annual event as a platform for national recovery following the devastation caused by Cyclone Ditwah. Addressing more than 800 delegates, including over 100 overseas investors, the Chamber’s Chairperson, Krishan Balendra began by [&#8230;]",3,sri lanka economic summit opened focus recovery resilience cyclone ditwah ceylon chamber commerce opened sri lanka economic 38 investment summit tuesday renewed sense purpose reframing annual event platform national recovery following devastation caused cyclone ditwah addressing 800 delegates including 100 overseas investors chamber chairperson krishan balendra began 8230,3,-0.4215,-3.0,-3.4215,High Risk
LankaBusinessOnline,Management committee of ‘Rebuilding Sri Lanka’ fund appointed with  reps from  public and pvt sectors,https://www.lankabusinessonline.com/management-committee-of-rebuilding-sri-lanka-fund-appointed-with-reps-from-public-and-pvt-sectors/,"Cabinet approval has been granted to establish the ‘Rebuilding Sri Lanka’ Fund, aimed at rebuilding the country following the severe devastation caused by Cyclone ‘Ditwah’, one of the worst natural disasters in Sri Lanka’s recent history. The Fund is to be established as a statutory fund under the Presidential Secretariat and its Management Committee will [&#8230;]",3,management committee rebuilding sri lanka fund appointed reps public pvt sectors cabinet approval granted establish rebuilding sri lanka fund aimed rebuilding country following severe devastation caused cyclone ditwah one worst natural disasters sri lanka recent history fund established statutory fund presidential secretariat management committee 8230,3,-0.7579,1.5,0.7421,Opportunity
LankaBusinessOnline,Sri Lanka introduces duty-free mechanism for overseas disaster relief donations,https://www.lankabusinessonline.com/sri-lanka-introduces-duty-free-mechanism-for-overseas-disaster-relief-donations/,"Due to the current disaster situation in the country, various inquiries have been made by foreign countries, organizations, individuals, as well as Sri Lankans living abroad, regarding donating essential goods to the people affected. Accordingly, the Government of Sri Lanka has introduced a more convenient procedure to expedite the clearance and distribution of all material [&#8230;]",3,sri lanka introduces duty free mechanism overseas disaster relief donations due current disaster situation country various inquiries made foreign countries organizations individuals well sri lankans living abroad regarding donating essential goods people affected accordingly government sri lanka introduced convenient procedure expedite clearance distribution material 8230,1,-0.3182,-7.0,-7.3182,High Risk
