Source,Title,Link,Summary,SEO_Score,cleaned,topic_cluster,sentiment_score,lexicon_score,impact_score,impact_level
LankaBusinessOnline,Ceylon Chamber affirms support for National recovery efforts following cyclone Ditwah,https://www.lankabusinessonline.com/ceylon-chamber-affirms-support-for-national-recovery-efforts-following-cyclone-ditwah/,"The Ceylon Chamber of Commerce is deeply saddened by the devastation caused by Cyclone Ditwah, and our thoughts are with all individuals, families, and communities affected by this tragedy. We mourn the loss of lives and acknowledge the immense hardship endured by thousands who have been displaced and whose livelihoods have been severely disrupted. In [&#8230;]",3,ceylon chamber affirms support national recovery efforts following cyclone ditwah ceylon chamber commerce deeply saddened devastation caused cyclone ditwah thoughts individuals families communities affected tragedy mourn loss lives acknowledge immense hardship endured thousands displaced whose livelihoods severely disrupted 8230,1,-0.9557,-10.0,-10.0,High Risk
LankaBusinessOnline,Telecom operators and partners accelerate restoration of connectivity after cyclone Ditwah,https://www.lankabusinessonline.com/telecom-operators-and-partners-accelerate-restoration-of-connectivity-after-cyclone-ditwah/,"Sri Lanka’s national telecommunication operators, in close coordination with government authorities, are intensifying round-the-clock recovery efforts to reconnect communities battered by severe flooding and landslidestriggered by Cyclone Ditwah since 27 November. The disaster has claimed 334 lives, left nearly 400 people missing or unaccounted for, and affected more than 1.3 million individuals nationwide, with rising [&#8230;]",3,telecom operators partners accelerate restoration connectivity cyclone ditwah sri lanka national telecommunication operators close coordination government authorities intensifying round clock recovery efforts reconnect communities battered severe flooding landslidestriggered cyclone ditwah since 27 november disaster claimed 334 lives left nearly 400 people missing unaccounted affected 1 3 million individuals nationwide rising 8230,5,-0.8591,-10.0,-10.0,High Risk
LankaBusinessOnline,Evolution Auto brings multi-brand electric vehicle showroom to Kurunegala,https://www.lankabusinessonline.com/evolution-auto-brings-multi-brand-electric-vehicle-showroom-to-kurunegala/,"Evolution Auto, a pioneer in Sri Lanka’s electric mobility sector, has officially opened its multi-brand electric vehicle (EV) showroom in Kurunegala, in collaboration with New Jayasekara Auto Motors (Pvt) Ltd. The new showroom offers customers a chance to explore, test drive, and purchase a wide range of electric vehicles, making eco-friendly transportation more accessible than [&#8230;]",3,evolution auto brings multi brand electric vehicle showroom kurunegala evolution auto pioneer sri lanka electric mobility sector officially opened multi brand electric vehicle ev showroom kurunegala collaboration new jayasekara auto motors pvt ltd new showroom offers customers chance explore test drive purchase wide range electric vehicles making eco friendly transportation accessible 8230,3,0.6369,0.0,0.6369,Opportunity
LankaBusinessOnline,Sri Lanka’s Central Bank keeps policy rate unchanged,https://www.lankabusinessonline.com/sri-lankas-central-bank-keeps-policy-rate-unchanged/,"The Monetary Policy Board, at its meeting held yesterday, decided to maintain the Overnight Policy Rate (OPR) at the current level of 7.75%. The Board arrived at this decision after carefully considering evolving developments and the outlook on both domestic and global fronts. The Board is of the view that the current monetary policy stance [&#8230;]",3,sri lanka central bank keeps policy rate unchanged monetary policy board meeting held yesterday decided maintain overnight policy rate opr current level 7 75 board arrived decision carefully considering evolving developments outlook domestic global fronts board view current monetary policy stance 8230,3,0.128,0.0,0.128,Neutral
LankaBusinessOnline,Acquisitions of Small Sri Lanka Banks Neutral to BOC’s and PB’s Ratings: Fitch Ratings,https://www.lankabusinessonline.com/acquisitions-of-small-sri-lanka-banks-neutral-to-bocs-and-pbs-ratings-fitch-ratings/,"Fitch Ratings says the proposed transfers of state-owned shares – of Housing Development Finance Corporation Bank of Sri Lanka (HDFC, BB+(lka)/Rating Watch Positive) to Bank of Ceylon (BOC, CCC+/AA-(lka)/Stable) and of State Mortgage &#38; Investment Bank (SMIB, BB(lka)/Rating Watch Positive) to People’s Bank (Sri Lanka) (PB, AA-(lka)/Stable) – are unlikely to affect the acquirers’ ratings. [&#8230;]",3,acquisitions small sri lanka banks neutral boc pb ratings fitch ratings fitch ratings says proposed transfers state owned shares housing development finance corporation bank sri lanka hdfc bb lka rating watch positive bank ceylon boc ccc aa lka stable state mortgage 38 investment bank smib bb lka rating watch positive people bank sri lanka pb aa lka stable unlikely affect acquirers ratings 8230,3,0.9153,2.0,2.9153,High Opportunity
LankaBusinessOnline,Central Bank keeps Overnight Policy Rate unchanged,https://www.lankabusinessonline.com/central-bank-keeps-overnight-policy-rate-unchanged/,"The Monetary Policy Board, at its meeting held yesterday, decided to maintain the Overnight Policy Rate (OPR) at the current level of 7.75%. The Board arrived at this decision after carefully considering evolving developments and the outlook on both domestic and global fronts. The Board is of the view that the current monetary policy stance [&#8230;]",3,central bank keeps overnight policy rate unchanged monetary policy board meeting held yesterday decided maintain overnight policy rate opr current level 7 75 board arrived decision carefully considering evolving developments outlook domestic global fronts board view current monetary policy stance 8230,3,0.128,0.0,0.128,Neutral
